{
  "schemaVersion": "1.0", "assetId": "neon-core-primary-button-normal", "generatedAt": "2026-07-15T14:00:00Z", "renderer": { "name": "lnh-prism-renderer", "version": "0.1.0" },
  "sources": { "style": { "id": "neon-core", "version": "0.1.0" }, "component": { "id": "primary-button", "version": "0.1.0" }, "materialPacks": [{ "id": "neon-core-materials", "version": "0.1.0" }] },
  "provenance": {
    "sourceTreeSha256": "ce29c724972dcd17c2d1af683dbb3f73afb301164900a52dd3da9f9fd52731ac",
    "sourceFiles": [
      { "role": "style-spec", "path": "specs/examples/style-neon-core.json", "sha256": "4aed9a66a1d85ff19d11e7bcbae0977f716993555f6027da5ffd7c92b718c2d0" },
      { "role": "component-spec", "path": "specs/examples/primary-button.json", "sha256": "eccdedf664edc596efddd81ef3f5823d1ba02510081563817ad3da6b6a89a65a" },
      { "role": "material-pack", "path": "specs/examples/neon-core-materials.json", "sha256": "4e66552b79a423ff8e1f07bd7fca5d1470f603a647070a21f7d846b9fecff4d7" },
      { "role": "material-source", "path": "materials/neon-core/blue-grain.json", "sha256": "b8fda8dd37463affacf4055493a9502e0194de549bd06286c8be59275ccb4c77" },
      { "role": "renderer-source", "path": "src/renderer/primary-button.ts", "sha256": "68d413738e95976de95d603253808277b901f7b2a5a8b6dec4bea49c1a220ee4" },
      { "role": "renderer-source", "path": "src/renderer/svg-recipes.ts", "sha256": "488bdb0bc31b8c303a7a0020e431363a61dcf3ecafa5a07eb510ef408589b9b5" },
      { "role": "renderer-version", "path": "src/renderer/version.ts", "sha256": "d4d7d4f5345874986c40b8ae91fef6569755c0c908d2bff7bfcf09250cf6693e" },
      { "role": "provenance-engine", "path": "src/renderer/provenance.ts", "sha256": "8ffa9f3f476b5d70ba5c7f1b37b31f233f70b3e0001935e7bf706f4e85fdd3ae" },
      { "role": "dependency-lock", "path": "package-lock.json", "sha256": "9e111c4ae81fa2d761b2cc291f628a19c7e27d4ca5ebd492b2ad0484aedd742c" }
    ]
  },
  "outputs": [{ "path": "exports/neon-core/primary-button/primary-button-normal.png", "format": "png", "width": 320, "height": 112, "sha256": "bbbbbbbbbbbbbbbbbbbbbbbbbbbbbbbbbbbbbbbbbbbbbbbbbbbbbbbbbbbbbbbb", "state": "normal", "unity": { "pixelsPerUnit": 100, "pivot": { "x": 0.5, "y": 0.5 }, "border": { "left": 24, "right": 24, "top": 24, "bottom": 24 }, "atlasGroup": "ui-neon-core" } }]
}
